{
  "frame_id": "f0190",
  "captured_at": "2026-10-31T16:16:00Z",
  "display_id": 1,
  "bundle_id": "com.lumen.quill",
  "app_name": "Lumen Quill",
  "window_title": "Acme Q4 Proposal \u2014 Draft",
  "window_id": 2201,
  "is_private_browsing": false,
  "url": null,
  "ocr": {
    "lines": [
      {
        "text": "Lumen Quill \u2014 Acme Q4 Proposal \u2014 Draft",
        "bbox": [
          66,
          9,
          337,
          27
        ],
        "confidence": 1.0
      },
      {
        "text": "16:16",
        "bbox": [
          1233,
          10,
          1268,
          27
        ],
        "confidence": 1.0
      },
      {
        "text": "DOCUMENT",
        "bbox": [
          14,
          48,
          205,
          63
        ],
        "confidence": 1.0
      },
      {
        "text": "Acme-Q4-Proposal.quill",
        "bbox": [
          0,
          71,
          219,
          104
        ],
        "confidence": 1.0
      },
      {
        "text": "OUTLINE",
        "bbox": [
          14,
          104,
          205,
          119
        ],
        "confidence": 1.0
      },
      {
        "text": "Purpose",
        "bbox": [
          0,
          128,
          219,
          161
        ],
        "confidence": 1.0
      },
      {
        "text": "Proposed timeline",
        "bbox": [
          0,
          161,
          219,
          194
        ],
        "confidence": 1.0
      },
      {
        "text": "Pricing",
        "bbox": [
          0,
          194,
          219,
          227
        ],
        "confidence": 1.0
      },
      {
        "text": "Q4 delivery risks",
        "bbox": [
          0,
          227,
          219,
          260
        ],
        "confidence": 1.0
      },
      {
        "text": "Acme-Q4-Proposal.quill",
        "bbox": [
          276,
          46,
          427,
          64
        ],
        "confidence": 1.0
      },
      {
        "text": "Draft",
        "bbox": [
          437,
          46,
          481,
          65
        ],
        "confidence": 1.0
      },
      {
        "text": "Owner: you",
        "bbox": [
          491,
          46,
          566,
          64
        ],
        "confidence": 1.0
      },
      {
        "text": "Acme Q4 Proposal",
        "bbox": [
          276,
          94,
          984,
          130
        ],
        "confidence": 1.0
      },
      {
        "text": "Draft \u2014 still editing at day end",
        "bbox": [
          276,
          136,
          984,
          157
        ],
        "confidence": 1.0
      },
      {
        "text": "Purpose",
        "bbox": [
          276,
          189,
          984,
          211
        ],
        "confidence": 1.0
      },
      {
        "text": "How Lumen Delivery will run the Acme Q4 rollout for Priya Natarajan.",
        "bbox": [
          276,
          218,
          984,
          239
        ],
        "confidence": 1.0
      },
      {
        "text": "Proposed timeline",
        "bbox": [
          276,
          263,
          984,
          285
        ],
        "confidence": 1.0
      },
      {
        "text": "Live demo on 14 Nov. Statement of work the week of 21 Nov.",
        "bbox": [
          276,
          291,
          984,
          312
        ],
        "confidence": 1.0
      },
      {
        "text": "Pricing",
        "bbox": [
          276,
          336,
          984,
          358
        ],
        "confidence": 1.0
      },
      {
        "text": "Published three-tier rate card. Recommended line: Current at 18500. Draft mail to Priya is waiting.",
        "bbox": [
          276,
          365,
          984,
          407
        ],
        "confidence": 1.0
      },
      {
        "text": "Q4 delivery risks",
        "bbox": [
          276,
          431,
          984,
          453
        ],
        "confidence": 1.0
      },
      {
        "text": "Harbor berth works and unnamed engineers remain open. This appendix is not finished.",
        "bbox": [
          276,
          459,
          984,
          480
        ],
        "confidence": 1.0
      },
      {
        "text": "The Acme proposal is still editing at day end and is not complete.",
        "bbox": [
          276,
          488,
          984,
          509
        ],
        "confidence": 1.0
      },
      {
        "text": "NOTES",
        "bbox": [
          1055,
          50,
          1266,
          65
        ],
        "confidence": 1.0
      },
      {
        "text": "{'Day end': 'still a draft'}",
        "bbox": [
          1041,
          73,
          1280,
          106
        ],
        "confidence": 1.0
      },
      {
        "text": "Risks appendix unfinished",
        "bbox": [
          1041,
          106,
          1280,
          139
        ],
        "confidence": 1.0
      }
    ]
  },
  "phash": "7c5c7c7c7c7c7c7c",
  "width": 1280,
  "height": 800,
  "capture_mode": "fixture"
}
