{
  "frame_id": "11411863-6ce4-5ed4-968f-1eefb1e7a78b",
  "captured_at": "2026-10-31T10:52:00Z",
  "display_id": 1,
  "bundle_id": "com.lumen.quill",
  "app_name": "Lumen Quill",
  "window_title": "Acme Q4 Proposal \u2014 Draft",
  "window_id": 2201,
  "is_private_browsing": false,
  "url": null,
  "ocr": {
    "lines": [
      {
        "text": "Lumen Quill \u2014 Acme Q4 Proposal \u2014 Draft",
        "bbox": [
          66,
          9,
          324,
          27
        ],
        "confidence": 1.0
      },
      {
        "text": "10:52",
        "bbox": [
          1238,
          10,
          1268,
          26
        ],
        "confidence": 1.0
      },
      {
        "text": "DOCUMENT",
        "bbox": [
          14,
          48,
          205,
          63
        ],
        "confidence": 1.0
      },
      {
        "text": "Acme-Q4-Proposal.quill",
        "bbox": [
          0,
          71,
          219,
          104
        ],
        "confidence": 1.0
      },
      {
        "text": "OUTLINE",
        "bbox": [
          14,
          104,
          205,
          120
        ],
        "confidence": 1.0
      },
      {
        "text": "Purpose",
        "bbox": [
          0,
          128,
          219,
          161
        ],
        "confidence": 1.0
      },
      {
        "text": "Proposed timeline",
        "bbox": [
          0,
          161,
          219,
          194
        ],
        "confidence": 1.0
      },
      {
        "text": "Pricing (stub)",
        "bbox": [
          0,
          194,
          219,
          227
        ],
        "confidence": 1.0
      },
      {
        "text": "Acme-Q4-Proposal.quill",
        "bbox": [
          276,
          46,
          424,
          65
        ],
        "confidence": 1.0
      },
      {
        "text": "Draft",
        "bbox": [
          434,
          46,
          476,
          65
        ],
        "confidence": 1.0
      },
      {
        "text": "Owner: you",
        "bbox": [
          486,
          46,
          557,
          65
        ],
        "confidence": 1.0
      },
      {
        "text": "Acme Q4 Proposal",
        "bbox": [
          276,
          94,
          984,
          130
        ],
        "confidence": 1.0
      },
      {
        "text": "Draft for Lumen Delivery \u00b7 pricing stub",
        "bbox": [
          276,
          136,
          984,
          157
        ],
        "confidence": 1.0
      },
      {
        "text": "Purpose",
        "bbox": [
          276,
          189,
          984,
          212
        ],
        "confidence": 1.0
      },
      {
        "text": "This draft sets out how Lumen Delivery will run the Acme Q4 rollout, including discovery, the live demo, and a priced statement of work.",
        "bbox": [
          276,
          218,
          984,
          260
        ],
        "confidence": 1.0
      },
      {
        "text": "Proposed timeline",
        "bbox": [
          276,
          284,
          984,
          306
        ],
        "confidence": 1.0
      },
      {
        "text": "Week of 7 Nov: internal dry run. Week of 14 Nov: live demo with Acme (pending agreement).",
        "bbox": [
          276,
          312,
          984,
          333
        ],
        "confidence": 1.0
      },
      {
        "text": "Pricing (stub)",
        "bbox": [
          276,
          357,
          984,
          380
        ],
        "confidence": 1.0
      },
      {
        "text": "Three named tiers will go here once Tom confirms we may use the published rate card rather than a custom quote.",
        "bbox": [
          276,
          386,
          984,
          428
        ],
        "confidence": 1.0
      },
      {
        "text": "Do not send this section to Priya yet.",
        "bbox": [
          276,
          436,
          984,
          457
        ],
        "confidence": 1.0
      },
      {
        "text": "NOTES",
        "bbox": [
          1055,
          50,
          1266,
          65
        ],
        "confidence": 1.0
      },
      {
        "text": "Back from a news glance",
        "bbox": [
          1041,
          73,
          1280,
          106
        ],
        "confidence": 1.0
      },
      {
        "text": "Add a pricing stub only",
        "bbox": [
          1041,
          106,
          1280,
          139
        ],
        "confidence": 1.0
      }
    ]
  },
  "phash": "7d7d5d7d5d7d7d7d",
  "width": 1280,
  "height": 800,
  "capture_mode": "fixture"
}
