{
  "frame_id": "6a037be2-56b9-568b-9151-3968f7f8e64a",
  "captured_at": "2026-10-31T15:49:15Z",
  "display_id": 1,
  "bundle_id": "com.lumen.anvil",
  "app_name": "Lumen Anvil",
  "window_title": "anvil \u2014 proposals/acme_q4.md",
  "window_id": 2601,
  "is_private_browsing": false,
  "url": null,
  "ocr": {
    "lines": [
      {
        "text": "Lumen Anvil \u2014 anvil \u2014 proposals/acme_q4.md",
        "bbox": [
          66,
          9,
          354,
          27
        ],
        "confidence": 1.0
      },
      {
        "text": "15:49",
        "bbox": [
          1237,
          10,
          1268,
          26
        ],
        "confidence": 1.0
      },
      {
        "text": "LUMEN-DELIVERY",
        "bbox": [
          14,
          48,
          205,
          63
        ],
        "confidence": 1.0
      },
      {
        "text": "proposals/acme_q4.md",
        "bbox": [
          0,
          71,
          219,
          104
        ],
        "confidence": 1.0
      },
      {
        "text": "rates/published.yaml",
        "bbox": [
          0,
          104,
          219,
          137
        ],
        "confidence": 1.0
      },
      {
        "text": "README.md",
        "bbox": [
          0,
          137,
          219,
          170
        ],
        "confidence": 1.0
      },
      {
        "text": "proposals/acme_q4.md",
        "bbox": [
          234,
          46,
          378,
          65
        ],
        "confidence": 1.0
      },
      {
        "text": "markdown",
        "bbox": [
          388,
          46,
          458,
          65
        ],
        "confidence": 1.0
      },
      {
        "text": "1",
        "bbox": [
          220,
          88,
          268,
          106
        ],
        "confidence": 1.0
      },
      {
        "text": "# Acme Q4 notes",
        "bbox": [
          268,
          88,
          375,
          106
        ],
        "confidence": 1.0
      },
      {
        "text": "2",
        "bbox": [
          220,
          106,
          268,
          124
        ],
        "confidence": 1.0
      },
      {
        "text": "3",
        "bbox": [
          220,
          124,
          268,
          143
        ],
        "confidence": 1.0
      },
      {
        "text": "Demo: 14 Nov (agreed with Tom Ashworth).",
        "bbox": [
          268,
          124,
          536,
          143
        ],
        "confidence": 1.0
      },
      {
        "text": "4",
        "bbox": [
          220,
          143,
          268,
          161
        ],
        "confidence": 1.0
      },
      {
        "text": "Card: published three-tier rate card, Current 18500.",
        "bbox": [
          268,
          143,
          583,
          161
        ],
        "confidence": 1.0
      },
      {
        "text": "5",
        "bbox": [
          220,
          161,
          268,
          179
        ],
        "confidence": 1.0
      },
      {
        "text": "TODO: finish Q4 delivery risks appendix.",
        "bbox": [
          268,
          161,
          517,
          179
        ],
        "confidence": 1.0
      },
      {
        "text": "anvil: opened proposals/acme_q4.md",
        "bbox": [
          232,
          200,
          1268,
          217
        ],
        "confidence": 1.0
      },
      {
        "text": "anvil: no tests in this tree",
        "bbox": [
          232,
          217,
          1268,
          234
        ],
        "confidence": 1.0
      }
    ]
  },
  "phash": "2010000000000000",
  "width": 1280,
  "height": 800,
  "capture_mode": "fixture"
}
