{
  "frame_id": "40a295e8-39ab-55fc-a7a1-26044ddf5585",
  "captured_at": "2026-11-06T14:01:15Z",
  "display_id": 1,
  "bundle_id": "com.lumen.compass",
  "app_name": "Lumen Compass",
  "window_title": "Pocket Calendar \u2014 Today",
  "window_id": 6401,
  "is_private_browsing": false,
  "url": null,
  "ocr": {
    "lines": [
      {
        "text": "Lumen Compass \u2014 Pocket Calendar \u2014 Today",
        "bbox": [
          66,
          9,
          348,
          27
        ],
        "confidence": 1.0
      },
      {
        "text": "14:01",
        "bbox": [
          1239,
          10,
          1268,
          26
        ],
        "confidence": 1.0
      },
      {
        "text": "Pocket Calendar",
        "bbox": [
          8,
          42,
          149,
          75
        ],
        "confidence": 1.0
      },
      {
        "text": "https://calendar.pocket.example/today",
        "bbox": [
          32,
          84,
          305,
          105
        ],
        "confidence": 1.0
      },
      {
        "text": "Pocket Calendar \u00b7 personal",
        "bbox": [
          40,
          137,
          1240,
          158
        ],
        "confidence": 1.0
      },
      {
        "text": "Friday 6 Nov",
        "bbox": [
          40,
          170,
          1240,
          204
        ],
        "confidence": 1.0
      },
      {
        "text": "12:00",
        "bbox": [
          40,
          220,
          79,
          241
        ],
        "confidence": 1.0
      },
      {
        "text": "Lunch",
        "bbox": [
          95,
          220,
          138,
          241
        ],
        "confidence": 1.0
      },
      {
        "text": "17:00",
        "bbox": [
          40,
          258,
          77,
          279
        ],
        "confidence": 1.0
      },
      {
        "text": "Library hold expires",
        "bbox": [
          93,
          258,
          234,
          279
        ],
        "confidence": 1.0
      }
    ]
  },
  "phash": "80ff00ffffffffff",
  "width": 1280,
  "height": 800,
  "capture_mode": "fixture"
}
